,title,view,u_date,link,e_date
389,NO048 You can build another terrace villa house with a yard bigger than your house,1.3천,202305,https://youtube.com/watch?v=ngK8twJlmuc&pp=ygUQ7J2A7ZaJIOyImOyImOujjA%3D%3D,202305
390,Focus on Federal Employment Performance Apple Johnson   Johnson Attention Ahn Seok hoon s Weekly New York Stock Exchange Briefing 230501,1.8천,202305,https://youtube.com/watch?v=ZQWLoi5XwYU&pp=ygUQ7J2A7ZaJIOyImOyImOujjA%3D%3D,202305
391,Bitcoin 25k and shit,816,202305,https://youtube.com/watch?v=i6lHN-da6lY&pp=ygUQ7J2A7ZaJIOyImOyImOujjA%3D%3D,202305
392,Bitcoin drops Altcoin sharply After Pepe Coin surged 320 000  Mimcoin followed by BRC20 Coin,2.5천,202305,https://youtube.com/watch?v=Bd5Wxk77FWY&pp=ygUQ7J2A7ZaJIOyImOyImOujjA%3D%3D,202305
393,Lectures on Accounting 20,37,202305,https://youtube.com/watch?v=AGmZGEYqse4&pp=ygUQ7J2A7ZaJIOyImOyImOujjA%3D%3D,202305
394,The meaning of the number KYC 125000 in Picoin Innovation is pi,4.9천,202305,https://youtube.com/watch?v=Cd2kvg1V30Q&pp=ygUQ7J2A7ZaJIOyImOyImOujjA%3D%3D,202305
395,0428 Bank shares rebound despite strong research core profit concerns 1Q earnings review It s okay to look now,439,202305,https://youtube.com/watch?v=URHQOYaKOV4&pp=ygUQ7J2A7ZaJIOyImOyImOujjA%3D%3D,202305
396,Michael Sailor  a large bank manager who checks after rumors of ripple victory,5.9천,202305,https://youtube.com/watch?v=rFsNOYRVZcU&pp=ygUQ7J2A7ZaJIOyImOyImOujjA%3D%3D,202305
397,Breaking News Picoin Baccada Outlet Cafe Integration New Payment Introduction Pi e Card Picoin Picoin Alt Coin,1.5천,202305,https://youtube.com/watch?v=YPxZ2aG3Psg&pp=ygUQ7J2A7ZaJIOyImOyImOujjA%3D%3D,202305
398,3 minute turnaround Overseas futures US options Thank you for the robust recharge and treasury stock purchase Apple Nasdaq crude oil gold 230508,25,202305,https://youtube.com/watch?v=r-FKk8eLKLM&pp=ygUQ7J2A7ZaJIOyImOyImOujjA%3D%3D,202305
399,Shopping for winter clothes for  5 in Australia,456,202305,https://youtube.com/watch?v=HFRPcnuh2HA&pp=ygUQ7J2A7ZaJIOyImOyImOujjA%3D%3D,202305
400,Be sure to hold this if you want to make a profit on the stock coin this year,4.2천,202305,https://youtube.com/watch?v=D7RRURCwRds&pp=ygUQ7J2A7ZaJIOyImOyImOujjA%3D%3D,202305
401,Ripple CEO hears rumors of sudden big banking partnership,5.7천,202305,https://youtube.com/watch?v=5zArJOLcftY&pp=ygUQ7J2A7ZaJIOyImOyImOujjA%3D%3D,202305
402,Pepe Coin is so hot  I m going to Long  I can t stand Mimcoin,913,202305,https://youtube.com/watch?v=N03XsN8Eidg&pp=ygUQ7J2A7ZaJIOyImOyImOujjA%3D%3D,202305
403,Cryptocurrency News by AI Sat May 20,8,202305,https://youtube.com/watch?v=sZxJSer5K5k&pp=ygUQ7J2A7ZaJIOyImOyImOujjA%3D%3D,202305
404,Germany s PHM sponsor  Jean Phidi  what does he do,93,202305,https://youtube.com/watch?v=luWCT260-Zg&pp=ygUQ7J2A7ZaJIOyImOyImOujjA%3D%3D,202305
405,Powell said there was no cut in the year  and the hawkish impression was discontinued  Aftermarket brief 230504,588,202305,https://youtube.com/watch?v=aXTh6p5UAac&pp=ygUQ7J2A7ZaJIOyImOyImOujjA%3D%3D,202305
406,Desperation foreseen by the marbled franchise,1.3만,202305,https://youtube.com/watch?v=COfktrGsOfw&pp=ygUQ7J2A7ZaJIOyImOyImOujjA%3D%3D,202305
407,Ripple BTC I Big Breaking I International Settlement Bank BIS I Federal Fednow Blame I XRP Preparation I Bitcoin   100 000 Reach I The market is growing,9.7천,202305,https://youtube.com/watch?v=z1DrHNA45Xo&pp=ygUQ7J2A7ZaJIOyImOyImOujjA%3D%3D,202305
408,the shocking method using the bit coin referral system reversely,6.4천,202305,https://youtube.com/watch?v=x-Qdug-bFAs&pp=ygUQ7J2A7ZaJIOyImOyImOujjA%3D%3D,202305
409,The time has come for the U S  Coin Company Declaration to set the direction of Ethereum,1.7만,202305,https://youtube.com/watch?v=HXoji2puzd0&pp=ygUQ7J2A7ZaJIOyImOyImOujjA%3D%3D,202305
410,I have received the judgment of         law  but why do not you give me money,106,202305,https://youtube.com/watch?v=5DI12dHDxR4&pp=ygUQ7J2A7ZaJIOyImOyImOujjA%3D%3D,202305
411,Collected mainly used camper cars such as new cars Used camper car consignment sale Lowest commission fee If you do not sell the car  you will not get money,4.3만,202305,https://youtube.com/watch?v=bpYZf7j1OAA&pp=ygUQ7J2A7ZaJIOyImOyImOujjA%3D%3D,202305
412,BRC20 Part 2 So Bitcoin contains almost everything from Good or Bad BRC20,3.9천,202305,https://youtube.com/watch?v=tBkWoTxPqjE&pp=ygUQ7J2A7ZaJIOyImOyImOujjA%3D%3D,202305
413,A rich evening of micropayments cash advance policy micropayments outstanding,1,202305,https://youtube.com/watch?v=PmC0QMPHuHM&pp=ygUQ7J2A7ZaJIOyImOyImOujjA%3D%3D,202305
414,NO1786 Paju New Construction Villa Let s go to the multi storey with the lowest price base price among the Paju multi storeys,263,202305,https://youtube.com/watch?v=MLk0fD5jKBc&pp=ygUQ7J2A7ZaJIOyImOyImOujjA%3D%3D,202305
415,NO257 Paju New Construction Villa Remaining Generation Discount Sale Paju Lowest Price 3 Room Terrace Type 2 000,185,202305,https://youtube.com/watch?v=uWmOxpUHVc0&pp=ygUQ7J2A7ZaJIOyImOyImOujjA%3D%3D,202305
416,1Pi 37215 won Picoin listed Justin Sun PI mentioned pi,5.8천,202305,https://youtube.com/watch?v=3TbsT2Uf9fc&pp=ygUQ7J2A7ZaJIOyImOyImOujjA%3D%3D,202305
417,3 things you need to know about investing in ASEAN  David in Singapore5STEPS,6.3천,202305,https://youtube.com/watch?v=i-DcgO40acI&pp=ygUQ7J2A7ZaJIOyImOyImOujjA%3D%3D,202305
418,The biggest disadvantage of the special bogeumjari theory is that there is a way to compensate for the too long examination period,858,202305,https://youtube.com/watch?v=RT7Jf_fvC7M&pp=ygUQ7J2A7ZaJIOyImOyImOujjA%3D%3D,202305
419,How to choose good ETF stocks for beginners Hong Chun wook Economist JTBC Sangam dong Class,3.8천,202305,https://youtube.com/watch?v=Ju2bZzjJPGk&pp=ygUQ7J2A7ZaJIOyImOyImOujjA%3D%3D,202305
420,Stock Coin Market Shakes When U S  Uses This Card Feat Bankrun,6.1천,202305,https://youtube.com/watch?v=_EqEvhBKBrI&pp=ygUQ7J2A7ZaJIOyImOyImOujjA%3D%3D,202305
421,Complete guide for beginners to join KYC certification in 5 minutes of bitget futures trading,207,202305,https://youtube.com/watch?v=Q3e8dQyiOBw&pp=ygUQ7J2A7ZaJIOyImOyImOujjA%3D%3D,202305
422,Intentional Crash Prospects Continue on Wall Street Intentional Bitcoin Behind Its Ethereum Ripple XRP Gala GALA Songbird Clayton,1.2만,202305,https://youtube.com/watch?v=5sg_y650FsU&pp=ygUQ7J2A7ZaJIOyImOyImOujjA%3D%3D,202305
423,Little Buffett Ackman If the US government does not respond quickly  the banking crisis will continue No local banks will survive at the current pace Retire with Tesla triple leverage,351,202305,https://youtube.com/watch?v=zXJcTmTQvtU&pp=ygUQ7J2A7ZaJIOyImOyImOujjA%3D%3D,202305
424,Application for registration of entrustment after winning bid Try it yourself without help of lawyer Self ownership transfer registration entrustment application Registration license registration fee Internet payment National housing bond purchase calculator,317,202305,https://youtube.com/watch?v=vZYG1cij70U&pp=ygUQ7J2A7ZaJIOyImOyImOujjA%3D%3D,202305
425,22 years high 2 June Q35,7,202305,https://youtube.com/watch?v=3LXRFHEzJ78&pp=ygUQ7J2A7ZaJIOyImOyImOujjA%3D%3D,202305
426,Lapidus  who established Japan vigorously to catch Samsung  but the reason why the Japanese were angry at the confession of the president,7.9천,202305,https://youtube.com/watch?v=CsU0iqLB38k&pp=ygUQ7J2A7ZaJIOyImOyImOujjA%3D%3D,202305
427,Torabisu Jaffang  who has been in trouble for a long time,2.2만,202305,https://youtube.com/watch?v=m4k7LboWf8I&pp=ygUQ7J2A7ZaJIOyImOyImOujjA%3D%3D,202305
428,Incentives 200 000 won 1 Low interest rate loans High interest rate savings 7 benefits better than work incentives,5.5만,202305,https://youtube.com/watch?v=lqdzNYBrRmQ&pp=ygUQ7J2A7ZaJIOyImOyImOujjA%3D%3D,202305
429,Translated by Dr  Kim Jung min,739,202305,https://youtube.com/watch?v=N8JdioqgRcw&pp=ygUQ7J2A7ZaJIOyImOyImOujjA%3D%3D,202305
430,Democratic Party s ban on late night rallies to sell the Constitution Jang Dong hyuk,2.4만,202305,https://youtube.com/watch?v=ijMz_hbJQmY&pp=ygUQ7J2A7ZaJIOyImOyImOujjA%3D%3D,202305
431,Bloomberg analysts The downside cycle is that the cryptocurrency market is still frozen by the Federal Reserve Chairman Powell,1.6천,202305,https://youtube.com/watch?v=nSmlnAEChuw&pp=ygUQ7J2A7ZaJIOyImOyImOujjA%3D%3D,202305
432,Aim for ETFs rather than gold  which is the best shot of the year,130,202305,https://youtube.com/watch?v=5iI56LQy300&pp=ygUQ7J2A7ZaJIOyImOyImOujjA%3D%3D,202305
433,Just before the FOMC  the bank broke down  Is it possible to create a rise in the Nasdaq like SVB bankruptcy this time,1.9만,202305,https://youtube.com/watch?v=QhW0Gwo4OZA&pp=ygUQ7J2A7ZaJIOyImOyImOujjA%3D%3D,202305
434,Look at Bitcoin CBDC Argentina,5.2천,202305,https://youtube.com/watch?v=RdiGt5JPrJQ&pp=ygUQ7J2A7ZaJIOyImOyImOujjA%3D%3D,202305
435,Hana Financial Group  Industrial Bank of Korea,123,202305,https://youtube.com/watch?v=t7QiOXSPoOk&pp=ygUQ7J2A7ZaJIOyImOyImOujjA%3D%3D,202305
436,Recurring Bank Anxiety Fog FOMC,484,202305,https://youtube.com/watch?v=YsNy9wTKuUo&pp=ygUQ7J2A7ZaJIOyImOyImOujjA%3D%3D,202305
437,Kim Seok ki  who was pissed off by the incitement of the Democratic Party that started,4.2만,202305,https://youtube.com/watch?v=IDIZtkH7Zfk&pp=ygUQ7J2A7ZaJIOyImOyImOujjA%3D%3D,202305
438,Money flowing story Bitcoin Binance withdrawal Stop Why Kim Yong young M Block Coin Editor,418,202305,https://youtube.com/watch?v=Ms9iY-ESlCI&pp=ygUQ7J2A7ZaJIOyImOyImOujjA%3D%3D,202305
439,The U S  debt ceiling will collapse at this time,9.8천,202305,https://youtube.com/watch?v=Go5wIP454T4&pp=ygUQ7J2A7ZaJIOyImOyImOujjA%3D%3D,202305
440,Coinbase s headquarters relocation ripple re listing,4천,202305,https://youtube.com/watch?v=PE9pl_ZvHp4&pp=ygUQ7J2A7ZaJIOyImOyImOujjA%3D%3D,202305
441,Ma Dong Seok Coin Mako Bit I wonder why we missed We caught it We have an answer in the chart I can not answer why Ethereum Bitcoin Alt Coin Corin Ripple FOMC NASDAQ,714,202305,https://youtube.com/watch?v=rgrdE8pxiUk&pp=ygUQ7J2A7ZaJIOyImOyImOujjA%3D%3D,202305
442,Profit certification 2 minutes a day Tax guide and easy monthly allowance New method Age education no side job prohibition Anyone can earn additional 400 000 won Free gift event,2.8만,202305,https://youtube.com/watch?v=92TjD5lme5I&pp=ygUQ7J2A7ZaJIOyImOyImOujjA%3D%3D,202305
443,Why do you run so far  The level of enjoying running has changed,1.1만,202305,https://youtube.com/watch?v=65bVFYUNDIk&pp=ygUQ7J2A7ZaJIOyImOyImOujjA%3D%3D,202305
444,News Live Korea s 35 year benchmark interest rate also reflects concerns over a frozen economy  YTN,1.2만,202305,https://youtube.com/watch?v=vgudCmDU4Vo&pp=ygUQ7J2A7ZaJIOyImOyImOujjA%3D%3D,202305
445,Banwol Station Walking Open Special Offer 2nd Generation Sale of Dooma Kyodong 48 pyeong Multi storey New Building Villa Gunpo Multi storey Villa Dooma Kyodong Multi storey Villa,19,202305,https://youtube.com/watch?v=f-zPLCRvdvQ&pp=ygUQ7J2A7ZaJIOyImOyImOujjA%3D%3D,202305
446,12 trillion invested in this country already PI national PI re up,7천,202305,https://youtube.com/watch?v=Q9hJ1XNp57U&pp=ygUQ7J2A7ZaJIOyImOyImOujjA%3D%3D,202305
447,Secretary General of the NHRCK  who posted the presidential election,4.2만,202305,https://youtube.com/watch?v=WNJV4d28R6M&pp=ygUQ7J2A7ZaJIOyImOyImOujjA%3D%3D,202305
448,I m going to lose 4 billion dollars in debt  Investors chasing the jackpot Pungbibaksan News zipMBC News,143만,202305,https://youtube.com/watch?v=loIG03wz-2Y&pp=ygUQ7J2A7ZaJIOyImOyImOujjA%3D%3D,202305
449,Why do we buy dollars from carrots and why do our money keep getting cheaper  SBS friendly economy,4.7천,202305,https://youtube.com/watch?v=xX7jFTpF-N4&pp=ygUQ7J2A7ZaJIOyImOyImOujjA%3D%3D,202305
450,Baby Dodge Binance Listing Confirmed Holders Need to Watch,900,202305,https://youtube.com/watch?v=jkSK60uGhJA&pp=ygUQ7J2A7ZaJIOyImOyImOujjA%3D%3D,202305
451,Ethereum Long 200 Million Misuse,871,202305,https://youtube.com/watch?v=ZOPuArP-oHY&pp=ygUQ7J2A7ZaJIOyImOyImOujjA%3D%3D,202305
452,Incheon New Building Villa Anbangman 3 rooms in the middle room A small room is perfect for 12 rooms with plenty of room size,547,202305,https://youtube.com/watch?v=1-Aqg9HiyxQ&pp=ygUQ7J2A7ZaJIOyImOyImOujjA%3D%3D,202305
453,Seoul Gas Crash Sold Case Solved Gong Byung ho TV,1.1천,202305,https://youtube.com/watch?v=AhIRn02L1bI&pp=ygUQ7J2A7ZaJIOyImOyImOujjA%3D%3D,202305
454,This guy is famous for his  208 million purchase of Picoin,1만,202305,https://youtube.com/watch?v=3tGvsmPe-Ho&pp=ygUQ7J2A7ZaJIOyImOyImOujjA%3D%3D,202305
455,For this reason  Bitcoin can rally up feat uniswap,6.4천,202305,https://youtube.com/watch?v=D9N3jEX3vsQ&pp=ygUQ7J2A7ZaJIOyImOyImOujjA%3D%3D,202305
456,Ripple CBDC Full Service Platform Releases Switching Motions After Ant Fizzle,5.7천,202305,https://youtube.com/watch?v=d898D15YbCQ&pp=ygUQ7J2A7ZaJIOyImOyImOujjA%3D%3D,202305
457,2023 Youth Entrepreneurship Loan Support,11,202305,https://youtube.com/watch?v=QaH398lp3LI&pp=ygUQ7J2A7ZaJIOyImOyImOujjA%3D%3D,202305
458,Expected goal of 7 000 won on comment from Dojikoin Changfeng Zhao,5.3천,202305,https://youtube.com/watch?v=cZjeUssv-4E&pp=ygUQ7J2A7ZaJIOyImOyImOujjA%3D%3D,202305
459,Ethereum 1 billion long 78 million won I ll eat a little and save me,1.7천,202305,https://youtube.com/watch?v=gKumJ3rFioM&pp=ygUQ7J2A7ZaJIOyImOyImOujjA%3D%3D,202305
460,Increasing the loan default rate means you can t pay off your debt,82,202305,https://youtube.com/watch?v=XyaPwb6dq2k&pp=ygUQ7J2A7ZaJIOyImOyImOujjA%3D%3D,202305
461,The world accepts RippleXRP,1만,202305,https://youtube.com/watch?v=qRxoXt5YHCw&pp=ygUQ7J2A7ZaJIOyImOyImOujjA%3D%3D,202305
462,I put a starter on my jacket and I do not bang it  Row seat production Royal Enfield Hunter 350 Constitutional seat All the stories of the world,173,202305,https://youtube.com/watch?v=6NQIHkayvBM&pp=ygUQ7J2A7ZaJIOyImOyImOujjA%3D%3D,202305
463,You re not a leftist if you know you re ashamed of that stupidity of Fukushima instigation,3.4천,202305,https://youtube.com/watch?v=VZx4K9p8_g0&pp=ygUQ7J2A7ZaJIOyImOyImOujjA%3D%3D,202305
464,Why did the Sisa Journal find out the real name of the suspicion of the Democratic money envelope,1.6만,202305,https://youtube.com/watch?v=f6iNJGEmeFY&pp=ygUQ7J2A7ZaJIOyImOyImOujjA%3D%3D,202305
465,China forwarding collection payment DP and DA,5,202305,https://youtube.com/watch?v=up6_5VlU_ZM&pp=ygUQ7J2A7ZaJIOyImOyImOujjA%3D%3D,202305
466,The real victim is a fetish of a lie cheater,2.8천,202305,https://youtube.com/watch?v=TDtEf6zpOeE&pp=ygUQ7J2A7ZaJIOyImOyImOujjA%3D%3D,202305
467,No 145 Inchon New Construction Jemulpo Station Area Payment 0,58,202305,https://youtube.com/watch?v=PDGwwXBkVKU&pp=ygUQ7J2A7ZaJIOyImOyImOujjA%3D%3D,202305
468,Incheon New Construction Villa First come first served first generation discount 200 million units This large and good house can be rented 0 won It is possible to stay in the station area for 5 minutes on foot from Dohwa Station,529,202305,https://youtube.com/watch?v=JClQBKsPoqg&pp=ygUQ7J2A7ZaJIOyImOyImOujjA%3D%3D,202305
469,Kim Nam guk More than 3 billion bold coin investments The most suspicious part of his money is the process of acquiring Wimix,11만,202305,https://youtube.com/watch?v=XAlcVl00Rto&pp=ygUQ7J2A7ZaJIOyImOyImOujjA%3D%3D,202305
470,Shouldn t you be blaming Putin for the war,4.3천,202305,https://youtube.com/watch?v=O-NwoTD06jk&pp=ygUQ7J2A7ZaJIOyImOyImOujjA%3D%3D,202305
471,NO146 Paju New construction The strongest caustic rain Unjeong station area 38 pyeong wide house,142,202305,https://youtube.com/watch?v=vNQUm7hxEFo&pp=ygUQ7J2A7ZaJIOyImOyImOujjA%3D%3D,202305
472,Earnings Review JB Financial Group NH Investment   Securities,87,202305,https://youtube.com/watch?v=uk6c5Qt17Xc&pp=ygUQ7J2A7ZaJIOyImOyImOujjA%3D%3D,202305
473,PICOIN PI HOUSE ISSUE HAPPENED  NOW  THERE S AN AMAZING SITUATION OF CAUTION,1만,202305,https://youtube.com/watch?v=A-4APtXv0aI&pp=ygUQ7J2A7ZaJIOyImOyImOujjA%3D%3D,202305
474,Collected mainly used camper cars such as new cars Used camper car consignment sale Lowest commission fee If you do not sell the car  you will not get money,4.3만,202305,https://youtube.com/watch?v=bpYZf7j1OAA&pp=ygUQ7J2A7ZaJIOyImOyImOujjA%3D%3D,202305
475,the coin money bomb signal in which the mask network time bomb signal coexists,131,202305,https://youtube.com/watch?v=ahNkS9RsDa0&pp=ygUQ7J2A7ZaJIOyImOyImOujjA%3D%3D,202305
476,Closed High Interest Rate Time Deposit Special Interest Rate is high and join the 1st grade Saemaeul Bank of Management Evaluation,1.3만,202305,https://youtube.com/watch?v=fXl5vapNdnI&pp=ygUQ7J2A7ZaJIOyImOyImOujjA%3D%3D,202305
477,Ripple s   1 trillion platinum coin production opinion US national bankruptcy D10 trillion platinum coin issuance ripple surge,7.6천,202305,https://youtube.com/watch?v=VQn9ThNW71o&pp=ygUQ7J2A7ZaJIOyImOyImOujjA%3D%3D,202305
478,Kim Nam guk suspected of laundering coin cash before and after the presidential election News A Live,3.6만,202305,https://youtube.com/watch?v=fCc5X0csbak&pp=ygUQ7J2A7ZaJIOyImOyImOujjA%3D%3D,202305
479,You can collect the bonds with forced withdrawal due to the seizure of the debtor s account,34,202305,https://youtube.com/watch?v=oAOf9Jk9R2Q&pp=ygUQ7J2A7ZaJIOyImOyImOujjA%3D%3D,202305
480,European style interior room deposit It is possible to arrange domestic house with minimum 40 pyeong type 3 room new construction villa formation Seoul life zone Possible Pocheon new construction villa front end new construction villa,45,202305,https://youtube.com/watch?v=Gv8ubmoBmPU&pp=ygUQ7J2A7ZaJIOyImOyImOujjA%3D%3D,202305
481,Anxiety and Concerns Dominating the Market GOOGL 257 Ahn Seok hoon s New York Stock Exchange Briefing 230517,1.4천,202305,https://youtube.com/watch?v=N-hcnoHWHDw&pp=ygUQ7J2A7ZaJIOyImOyImOujjA%3D%3D,202305
482,I have never rested in Daejeon  Front and back seat Custom latex Honda Super Curve Yongheon Sheet All the stories of the world,93,202305,https://youtube.com/watch?v=UWbOGKKuMBU&pp=ygUQ7J2A7ZaJIOyImOyImOujjA%3D%3D,202305
483,Kim Nam guk Nobody knows how to make 3 billion cash for money laundering Resistance TV Jung Kwang yong TV,1.8만,202305,https://youtube.com/watch?v=EETSFqNcmRE&pp=ygUQ7J2A7ZaJIOyImOyImOujjA%3D%3D,202305
484,Closing bell  FOMC minutes announcement also Debt negotiation difficulty US stock market declines all at once Money Today broadcasting stock market securities,4.2천,202305,https://youtube.com/watch?v=S558OCi3Fc4&pp=ygUQ7J2A7ZaJIOyImOyImOujjA%3D%3D,202305
485,Located in the station area of Yeokchon Station  Yeokchon dong 38 pyeong 3 room new style villa residential detached single dining room Eunpyeong gu new style villa,최초 공개일: 23. 6. 1. 18:00,202305,https://youtube.com/watch?v=cYz3SgHnSvU&pp=ygUQ7J2A7ZaJIOyImOyImOujjA%3D%3D,202305
486,Tech Investment News by AI Sat May 20,7일 전,202305,https://youtube.com/watch?v=QZ855HyHWYw&pp=ygUQ7J2A7ZaJIOyImOyImOujjA%3D%3D,202305
