,title,view,u_date,link,e_date
127,NO 131 Incheon new construction Gajwa station Let s have my house with cheaper interest than the super station area charter,6일 전,202305,https://youtube.com/watch?v=Tvez18x_1Ac&pp=ygUQ7J2A7ZaJIOyImOyImOujjA%3D%3D,202305
128,Recipe Book 8 Respiratory System Disease Caregiver Handwriting Caregiver Lecture Key Points,6일 전,202305,https://youtube.com/watch?v=XFuVT0aYGMA&pp=ygUQ7J2A7ZaJIOyImOyImOujjA%3D%3D,202305
129,NO154 Incheon New Construction Sungui Station It is a subway station area and the sale price is cheap,8일 전,202305,https://youtube.com/watch?v=xBl7oR8KmGc&pp=ygUQ7J2A7ZaJIOyImOyImOujjA%3D%3D,202305
130,Entering Shanghai  China From WeChat Hell to Cacao Pei Didi Chuxing Bund Night View Shanghai 01,4주 전,202305,https://youtube.com/watch?v=dSg6supOKjI&pp=ygUQ7J2A7ZaJIOyImOyImOujjA%3D%3D,202305
131,NO117 Paju New Construction Opportunity Room 4 2 300 million Amazing sale price,3일 전,202305,https://youtube.com/watch?v=lW6p_fV_gjw&pp=ygUQ7J2A7ZaJIOyImOyImOujjA%3D%3D,202305
132,Lee Jae myeong Goodbye Democratic Party s 5th Lieutenant Lee Sang min s resignation Request for public release Kim Nam guk Confirmation of 250 million cash withdrawal Lee Jae myeong s presidential fund Pandora s box was opened,4주 전,202305,https://youtube.com/watch?v=Dlq8W1LFe_I&pp=ygUQ7J2A7ZaJIOyImOyImOujjA%3D%3D,202305
133,News Breaking News Son and Daughter Desperately Call Mom to Pay My Debt Jung Wan jin TV,12일 전,202305,https://youtube.com/watch?v=ErtlZUlZ8Rw&pp=ygUQ7J2A7ZaJIOyImOyImOujjA%3D%3D,202305
134,Event Update NO106 Incheon New Construction Juan Station Double Station Area 50 million won discount sale,3주 전,202305,https://youtube.com/watch?v=S0HfaswB4JU&pp=ygUQ7J2A7ZaJIOyImOyImOujjA%3D%3D,202305
135,NO118 Paju New Construction Opposition Station The location of the subway station is good,4일 전,202305,https://youtube.com/watch?v=fzB_ePM69gw&pp=ygUQ7J2A7ZaJIOyImOyImOujjA%3D%3D,202305
136,Invest like this in an unstable economy  and your old age worries will be resolved,2주 전,202305,https://youtube.com/watch?v=CBlSSMWp3A4&pp=ygUQ7J2A7ZaJIOyImOyImOujjA%3D%3D,202305
137,AI Bubble TQQQ vs Cash Trading Strategy is ai tqqq sqqq Kevin Kang Teiba Lab Representative Yonhap News Economy TV 230523 Good Morning InfoMax,2주 전,202305,https://youtube.com/watch?v=OgVoHMy3Mcc&pp=ygUQ7J2A7ZaJIOyImOyImOujjA%3D%3D,202305
138,Wedding Planner Free Service Gangnam 32 year old wedding shop Direct wedding consulting company to participate in the half price wedding preparation campaign,2주 전,202305,https://youtube.com/watch?v=OvEWUgFCoWw&pp=ygUQ7J2A7ZaJIOyImOyImOujjA%3D%3D,202305
139,First Way to Choose Investment Stocks Do not invest in products you do not know,9일 전,202305,https://youtube.com/watch?v=cYAd3m-st_I&pp=ygUQ7J2A7ZaJIOyImOyImOujjA%3D%3D,202305
140,Goyang City Premium Townhouse Open Wichita Living Area Only 17th Generation Dalmaji Park Forest Three Views Everything is a perfect townhouse VILLAMARKET,8일 전,202305,https://youtube.com/watch?v=BxmWR2equSU&pp=ygUQ7J2A7ZaJIOyImOyImOujjA%3D%3D,202305
141,TECH PINTECH NEWS by AI Neck  May 18,2주 전,202305,https://youtube.com/watch?v=zxmDhWUmP6o&pp=ygUQ7J2A7ZaJIOyImOyImOujjA%3D%3D,202305
142,ENG SUB HIPJIRO WORKERS EP14 Plan for Holiday,11일 전,202305,https://youtube.com/watch?v=cE9OLIZRdC8&pp=ygUQ7J2A7ZaJIOyImOyImOujjA%3D%3D,202305
143,The importance of assetization of IB Deal information,2주 전,202305,https://youtube.com/watch?v=0-_zJ8QxaMg&pp=ygUQ7J2A7ZaJIOyImOyImOujjA%3D%3D,202305
144,016610DB Financial Investment Stock Price Outlook and Chart Analysis,4일 전,202305,https://youtube.com/watch?v=Za2RmQLDBu0&pp=ygUQ7J2A7ZaJIOyImOyImOujjA%3D%3D,202305
145,Liszt Liebestraum Cello Version,6일 전,202305,https://youtube.com/watch?v=TmDTrdFQIDg&pp=ygUQ7J2A7ZaJIOyImOyImOujjA%3D%3D,202305
146,Pocheon New Construction Villa Terrace video is uploaded and sold in 3 weeks  and the first generation is left,6일 전,202305,https://youtube.com/watch?v=Be8rlhIoTOI&pp=ygUQ7J2A7ZaJIOyImOyImOujjA%3D%3D,202305
147,KF21 fighter jet 265 takes off,4주 전,202305,https://youtube.com/watch?v=eBY5ThYC_3Y&pp=ygUQ7J2A7ZaJIOyImOyImOujjA%3D%3D,202305
148,Announcers who tongued the amount of the excuse fee increase of the Japanese banks seen in the recent bankruptcy of the Japanese bank fee,7.5천,202305,https://youtube.com/watch?v=4TexwJdsVQI&pp=ygUQ7J2A7ZaJIOyImOyImOujjA%3D%3D,202305
149,Wet clothes in the drizzle Various fees Save this Son Hee Ae Financial Creator JTBC Sangam dong Class,958,202305,https://youtube.com/watch?v=TfX9smRzfTE&pp=ygUQ7J2A7ZaJIOyImOyImOujjA%3D%3D,202305
150,Since June  people like this have been unable to make bank ATM cash withdrawals,15만,202305,https://youtube.com/watch?v=DUef-LQ-Flk&pp=ygUQ7J2A7ZaJIOyImOyImOujjA%3D%3D,202305
151,From now on  make sure to transfer all bank accounts like this,1.2만,202305,https://youtube.com/watch?v=raVAF-alQ4M&pp=ygUQ7J2A7ZaJIOyImOyImOujjA%3D%3D,202305
152,I ve been paying such a huge fee,144,202305,https://youtube.com/watch?v=6ytyFCR4P1w&pp=ygUQ7J2A7ZaJIOyImOyImOujjA%3D%3D,202305
153,If you have this card  you should cancel it immediately  Shinhan KB Kookmin Samsung Hyundai Lotte HanaBC Card,60만,202305,https://youtube.com/watch?v=K53BPm4CJOs&pp=ygUQ7J2A7ZaJIOyImOyImOujjA%3D%3D,202305
154,If you do not know  you will only lose money  Bank financial benefits over 65 years old All 12 elderly people apply now 2023 Latest version 8 minutes Arrangement Insurance Pension benefits etc,2.3만,202305,https://youtube.com/watch?v=DvkKea1sAME&pp=ygUQ7J2A7ZaJIOyImOyImOujjA%3D%3D,202305
155,Even if you only get paid for the salary club  you can get a lot of prizes,105,202305,https://youtube.com/watch?v=l_1oVfv-FxM&pp=ygUQ7J2A7ZaJIOyImOyImOujjA%3D%3D,202305
156,When the middle plate and the pin tech company are united  you make money because the end of the trade remittance comes out,353,202305,https://youtube.com/watch?v=eiohWg0QMig&pp=ygUQ7J2A7ZaJIOyImOyImOujjA%3D%3D,202305
157,97 people do not know every month  and they pay half of the money,461,202305,https://youtube.com/watch?v=whXWiowb4Ew&pp=ygUQ7J2A7ZaJIOyImOyImOujjA%3D%3D,202305
158,Give me 20 when you get the compensation for conscription Wow Left s commission business,6.7천,202305,https://youtube.com/watch?v=WwNwGPtTRjI&pp=ygUQ7J2A7ZaJIOyImOyImOujjA%3D%3D,202305
159,Please note that there are no more than three monthly payments,3만,202305,https://youtube.com/watch?v=KRenY3aIUpI&pp=ygUQ7J2A7ZaJIOyImOyImOujjA%3D%3D,202305
160,Busan Bank Kyungnam Bank Special Lecture 2023 Comprehensive Interview Competency Interview Discussion Interview,359,202305,https://youtube.com/watch?v=AtDz0U1VsEQ&pp=ygUQ7J2A7ZaJIOyImOyImOujjA%3D%3D,202305
161,Interest rate outlook Let s look at the BOK s interest rate outlook based on US interest rate adjustment Interest rate outlook Bank of Korea,822,202305,https://youtube.com/watch?v=t84Q1jbesRE&pp=ygUQ7J2A7ZaJIOyImOyImOujjA%3D%3D,202305
162,Why don t you buy XX instead of trusting it when the bank goes bankrupt,747,202305,https://youtube.com/watch?v=R5OiW3C0oic&pp=ygUQ7J2A7ZaJIOyImOyImOujjA%3D%3D,202305
163,If you do this bank transaction  you will get 1 million won cash back,1천,202305,https://youtube.com/watch?v=9R3DZ_J8gx8&pp=ygUQ7J2A7ZaJIOyImOyImOujjA%3D%3D,202305
164,Banking is changing due to voice phishing damage,2.6천,202305,https://youtube.com/watch?v=y1rOUBAPa0U&pp=ygUQ7J2A7ZaJIOyImOyImOujjA%3D%3D,202305
165,Let s dissect the lowest interest rate mortgage Kakao Bank products,1.3만,202305,https://youtube.com/watch?v=9axgmnSQjlE&pp=ygUQ7J2A7ZaJIOyImOyImOujjA%3D%3D,202305
166,TMF Fee Dividend Ratio Management Company Stability History is perfectly organized,3.4천,202305,https://youtube.com/watch?v=RpI1i2AmjMk&pp=ygUQ7J2A7ZaJIOyImOyImOujjA%3D%3D,202305
167,Overseas Travel Essential Card Exchange Preferential 100 How to use it as a standard rate of sale I have already saved a 500 000 won commission to the event,6.8천,202305,https://youtube.com/watch?v=QER9nxx_YwI&pp=ygUQ7J2A7ZaJIOyImOyImOujjA%3D%3D,202305
168,Tomato System April 27th I made a listing fee  I succeeded in escaping,4.1천,202305,https://youtube.com/watch?v=nS8EYwts5Zo&pp=ygUQ7J2A7ZaJIOyImOyImOujjA%3D%3D,202305
169,Local bank volatility has declined  but price indexes and debt negotiations are on the decline  Lucid Group 558 Ahn Seok hoon s New York Stock Exchange Briefing 230510,1.4천,202305,https://youtube.com/watch?v=QKz20iaDfx0&pp=ygUQ7J2A7ZaJIOyImOyImOujjA%3D%3D,202305
170,G90 used car Prestige sunroof Havana brown sheet glass coating wheel restoration completed Busan representative,10일 전,202305,https://youtube.com/watch?v=fqr3NXPg-C8&pp=ygUQ7J2A7ZaJIOyImOyImOujjA%3D%3D,202305
171,I m bitten with a long shot and another 100 million won  LOL,3주 전,202305,https://youtube.com/watch?v=ojJdkX9Hx0A&pp=ygUQ7J2A7ZaJIOyImOyImOujjA%3D%3D,202305
172,Ripple lawsuit critical variable US SEC tailed Krypto Blabla,4일 전,202305,https://youtube.com/watch?v=dwMZN7BAMdY&pp=ygUQ7J2A7ZaJIOyImOyImOujjA%3D%3D,202305
173,ET 100 million won tax 0 won Bibimbap passbook ISA general affairs KBS 20300509,4일 전,202305,https://youtube.com/watch?v=UoPgCpLNYDc&pp=ygUQ7J2A7ZaJIOyImOyImOujjA%3D%3D,202305
174,Bucheon apartment sale 35 pyeong hot water station Line 7 Gangnam line limited master Seoul apartment Take half price,1일 전,202305,https://youtube.com/watch?v=dhdL7OL2R-Y&pp=ygUQ7J2A7ZaJIOyImOyImOujjA%3D%3D,202305
175,June Coin Ripple Coin XRP Ripple Icon Bitcoin Coin Forecast Cryptocurrency Coin Coin Lau Walk,1.1천,202305,https://youtube.com/watch?v=J8CnsDQwX-Y&pp=ygUQ7J2A7ZaJIOyImOyImOujjA%3D%3D,202305
176,Stock Coin Investors Must Be Prepared This Week,8.4천,202305,https://youtube.com/watch?v=_gM4t58-Qc4&pp=ygUQ7J2A7ZaJIOyImOyImOujjA%3D%3D,202305
177,Fantastic Yedang Lake Music Fountain Jang Yoon jung Pig Rabbit Wax Brother DJ DOC Run To You,308,202305,https://youtube.com/watch?v=3eSmoiyNGVU&pp=ygUQ7J2A7ZaJIOyImOyImOujjA%3D%3D,202305
178,800 trillion Google web30 Hedera Coin LG Shinhan Bank,422,202305,https://youtube.com/watch?v=uZIRbkXhX7Y&pp=ygUQ7J2A7ZaJIOyImOyImOujjA%3D%3D,202305
179,Gyeongbuk Chilgok County Shindongjae Acacia Community Site Here Yushin Show 20300504,22,202305,https://youtube.com/watch?v=e5_dtvItOu0&pp=ygUQ7J2A7ZaJIOyImOyImOujjA%3D%3D,202305
180,Deco Seats for Jinyeong Furniture Deco Seats 3600 won 4200 won 17 9 billion high investment 10 weeks 2 000 won commission,2.4천,202305,https://youtube.com/watch?v=kH5lXTeJY28&pp=ygUQ7J2A7ZaJIOyImOyImOujjA%3D%3D,202305
181,6 Things You Need to Know About Ripple XRP,1.3만,202305,https://youtube.com/watch?v=3Vm_ooCblOE&pp=ygUQ7J2A7ZaJIOyImOyImOujjA%3D%3D,202305
182,Local bank unrest falls for 4 days Two rises after Apple closed Ahn Seok hoon s New York stock market briefing 230505,1천,202305,https://youtube.com/watch?v=bO1-e-_BgIY&pp=ygUQ7J2A7ZaJIOyImOyImOujjA%3D%3D,202305
183,Kim Nam guk  BitTorrent  etc   made 4 billion won and once called 10 billion units  186 coin commission income like exchange SBS Channel A report,2.5만,202305,https://youtube.com/watch?v=OAWp87kNl0c&pp=ygUQ7J2A7ZaJIOyImOyImOujjA%3D%3D,202305
184,Do not trust a clean copy of the register anymore  If you do not do this  you will lose your house,1만,202305,https://youtube.com/watch?v=3iKT3Z8L2Uc&pp=ygUQ7J2A7ZaJIOyImOyImOujjA%3D%3D,202305
185,Tesla 550 Ahn Seok hoon s New York Stock Exchange Briefing 230506,1.7천,202305,https://youtube.com/watch?v=0BdIOqaMZyQ&pp=ygUQ7J2A7ZaJIOyImOyImOujjA%3D%3D,202305
186,BRC20 is good for bit coin 190 times bad coffee break,2.9천,202305,https://youtube.com/watch?v=qwtCg9Wlqfw&pp=ygUQ7J2A7ZaJIOyImOyImOujjA%3D%3D,202305
187,Why Coin Is Shaking Now,3.6천,202305,https://youtube.com/watch?v=l2KOB0ehTh8&pp=ygUQ7J2A7ZaJIOyImOyImOujjA%3D%3D,202305
188,Chinese reaction to Lee Kang in goal against Athletic Bilbao,448,202305,https://youtube.com/watch?v=VLJZ0kOI-sQ&pp=ygUQ7J2A7ZaJIOyImOyImOujjA%3D%3D,202305
189,Subtitle translation  Wagner declared withdrawal of mercenary troops encroached on Chinese foreign capital,962,202305,https://youtube.com/watch?v=y8J5LFR0TC0&pp=ygUQ7J2A7ZaJIOyImOyImOujjA%3D%3D,202305
190,Why Japan failed to raise interest rates Feat Japan s economic situation,3.7천,202305,https://youtube.com/watch?v=gpToOKFVXP4&pp=ygUQ7J2A7ZaJIOyImOyImOujjA%3D%3D,202305
191,American WEST Program Intern Vlog New York Kaplan Language School Cincinnati University,38,202305,https://youtube.com/watch?v=ydg3JZuhQpU&pp=ygUQ7J2A7ZaJIOyImOyImOujjA%3D%3D,202305
192,Bitcoin is the worst crisis ever feat The biggest beneficiary Coin Etherium Ripple Crypto Investment Economy CPI Consumer Price Rate Dollar Rate Fed Apple Tesla Stock Real Estate Rechargeable Battery Semiconductor,4.1천,202305,https://youtube.com/watch?v=Jj2N41OtkUs&pp=ygUQ7J2A7ZaJIOyImOyImOujjA%3D%3D,202305
193,11 months after this happened  on average  there was a recession,5.9천,202305,https://youtube.com/watch?v=UhcVF1b2Lks&pp=ygUQ7J2A7ZaJIOyImOyImOujjA%3D%3D,202305
194,Warren Buffett s horrifying real reason for investing in Japan Feat life reversal opportunity,5.5천,202305,https://youtube.com/watch?v=D0bY1Oyu87o&pp=ygUQ7J2A7ZaJIOyImOyImOujjA%3D%3D,202305
195,Samsung Bank Apple Bank Federal Reserve Board Immediate Payment Service Ripple s XRP Perfect Spot is on its last surge,4.3천,202305,https://youtube.com/watch?v=6ajQQgV7Gv8&pp=ygUQ7J2A7ZaJIOyImOyImOujjA%3D%3D,202305
196,Successful Forecast Lee Dae ho Part 1 Full image Comprehensive Income Tax World Comprehensive Income Tax Subject and Report Method World Tax Credit Benefits and Tax Refund of Comprehensive Income Tax KBS 230508 Broadcast,2.9만,202305,https://youtube.com/watch?v=msUHbhW_FQc&pp=ygUQ7J2A7ZaJIOyImOyImOujjA%3D%3D,202305
197,Status and Expansion of Online One Stop Loan Infrastructure,268,202305,https://youtube.com/watch?v=PVRDk_iH1hw&pp=ygUQ7J2A7ZaJIOyImOyImOujjA%3D%3D,202305
198,Continuing U S  Bank Issues and DCG s Loan Repayment Story to Become May Issue,1.5만,202305,https://youtube.com/watch?v=SIWSH_EnVc0&pp=ygUQ7J2A7ZaJIOyImOyImOujjA%3D%3D,202305
199,Three Major Volatility Factors Local Bank Price Index Debt Limit Ahn Seok hoon s Weekly New York Stock Exchange Briefing 230508,1.9천,202305,https://youtube.com/watch?v=FKwlMwVadSY&pp=ygUQ7J2A7ZaJIOyImOyImOujjA%3D%3D,202305
200,Bitcoin wiped out from here millions to billions of billions,1.3만,202305,https://youtube.com/watch?v=Hc0PkYkruOY&pp=ygUQ7J2A7ZaJIOyImOyImOujjA%3D%3D,202305
201,Ripple preparing to take over companies with  1 billion in cash,1일 전,202305,https://youtube.com/watch?v=ooUky9MLiwQ&pp=ygUQ7J2A7ZaJIOyImOyImOujjA%3D%3D,202305
202,Urgent U S  Debt Limit Negotiation Is About to End,1일 전,202305,https://youtube.com/watch?v=n4BhgmKaynE&pp=ygUQ7J2A7ZaJIOyImOyImOujjA%3D%3D,202305
203,Ripple XRP US Federal Reserve Bank Ripple Payment Method Ripple Chart Analysis Upbit,1일 전,202305,https://youtube.com/watch?v=j3yn1gm1BrQ&pp=ygUQ7J2A7ZaJIOyImOyImOujjA%3D%3D,202305
204,Gangnam Raemian Blessage Seocho Acro River Park Banpo Raemian Songpa Helio City Catastrophe,스트리밍 시간: 1일 전,202305,https://youtube.com/watch?v=YducJjRpHdQ&pp=ygUQ7J2A7ZaJIOyImOyImOujjA%3D%3D,202305
205,Ripple XRP is an emergency US Federal Reserve Ripple payment method,2일 전,202305,https://youtube.com/watch?v=sLtS2uWxYQU&pp=ygUQ7J2A7ZaJIOyImOyImOujjA%3D%3D,202305
206,The 110th YouTube Yang Auction Buddhist Antiquities Preview,3일 전,202305,https://youtube.com/watch?v=PODBbI1Oodo&pp=ygUQ7J2A7ZaJIOyImOyImOujjA%3D%3D,202305
207,Ripple XRP Hong Kong giant bank partnership with Fubon Bank How much do you want to go up Ripple Upbit,2일 전,202305,https://youtube.com/watch?v=JkMKX_5d7yk&pp=ygUQ7J2A7ZaJIOyImOyImOujjA%3D%3D,202305
208,Bitcoin Pepe Coin PEPE Mimcoin MEME MetaMask Wallet Understanding how to participate in Pink Sale and Fry token,스트리밍 시간: 3일 전,202305,https://youtube.com/watch?v=twglCW8MNmA&pp=ygUQ7J2A7ZaJIOyImOyImOujjA%3D%3D,202305
209,Ripple XRP Affiliate with Hong Kong giant bank Fubon Bank Chinese brothers are coming How much are you going to go up Ripple chart analysis upbit,1일 전,202305,https://youtube.com/watch?v=-UktulzYCTg&pp=ygUQ7J2A7ZaJIOyImOyImOujjA%3D%3D,202305
210,If it s dangerous here  there could be a stock coin crash,3일 전,202305,https://youtube.com/watch?v=pj2ZJqJNPDQ&pp=ygUQ7J2A7ZaJIOyImOyImOujjA%3D%3D,202305
211,China s invasion of Taiwan is dangerous,3일 전,202305,https://youtube.com/watch?v=4dnoRR_ZSm0&pp=ygUQ7J2A7ZaJIOyImOyImOujjA%3D%3D,202305
212,Just before the announcement of the end of the Ripple Bank of America Ripple lawsuit  we will get a contract,3일 전,202305,https://youtube.com/watch?v=jss3sWNjX5w&pp=ygUQ7J2A7ZaJIOyImOyImOujjA%3D%3D,202305
213,Right now  TLT and TMF are low cost opportunities  and even in the worst case scenario,3일 전,202305,https://youtube.com/watch?v=qQcTKHg_Yew&pp=ygUQ7J2A7ZaJIOyImOyImOujjA%3D%3D,202305
214,Traveling to Japan from Gimhae Airport to Fukuoka Airport,1일 전,202305,https://youtube.com/watch?v=tZePjhKckLE&pp=ygUQ7J2A7ZaJIOyImOyImOujjA%3D%3D,202305
215,Ripple Hinman Spikey Public Hong Kong Fubon Bank Emergency Announcement Litigation Consensus Rise Why We Should Buy Ripples and Stacks,1일 전,202305,https://youtube.com/watch?v=HHHu-oBg0sY&pp=ygUQ7J2A7ZaJIOyImOyImOujjA%3D%3D,202305
216,I ll show you the results of Ripple XRP of 100 000 won,3일 전,202305,https://youtube.com/watch?v=A_0xZuM9tHI&pp=ygUQ7J2A7ZaJIOyImOyImOujjA%3D%3D,202305
217,The house in the United States is going to be handed over to the bank  The house I bought recently in the United States is so hard to live that it is too hard to pay the loan  How can I keep the house  Help me,1일 전,202305,https://youtube.com/watch?v=cqe1JcKo5oo&pp=ygUQ7J2A7ZaJIOyImOyImOujjA%3D%3D,202305
218,Reasons to Expect More Than 100 Million Bitcoins in a Year,3일 전,202305,https://youtube.com/watch?v=cQvenq9kMjY&pp=ygUQ7J2A7ZaJIOyImOyImOujjA%3D%3D,202305
219,This is what will happen in the future of Bitcoin  which is increasingly digging into the financial sector,2주 전,202305,https://youtube.com/watch?v=cl_issT7KEQ&pp=ygUQ7J2A7ZaJIOyImOyImOujjA%3D%3D,202305
220,10 Treasuries Investment Strategies that can make profits As safe as deposits,1개월 전,202305,https://youtube.com/watch?v=qr380fPTJ5w&pp=ygUQ7J2A7ZaJIOyImOyImOujjA%3D%3D,202305
221,Why Baby Dodge Crash Can Come Without Decentralization Find out Baby Dodge Coin,1개월 전,202305,https://youtube.com/watch?v=BPXdUHft7RU&pp=ygUQ7J2A7ZaJIOyImOyImOujjA%3D%3D,202305
222,Big Bang Heaven Part 2 Tomorrow  Plus Echo Plastics 5567 Excavation Secrets Mini Lecture,1개월 전,202305,https://youtube.com/watch?v=YdiVONoueJI&pp=ygUQ7J2A7ZaJIOyImOyImOujjA%3D%3D,202305
223,DACOSYSTEM Marketing Plan,1일 전,202305,https://youtube.com/watch?v=R6S7W4dyDtA&pp=ygUQ7J2A7ZaJIOyImOyImOujjA%3D%3D,202305
224,Ontology gas restaurant opens This year s coin farming ends with this,1일 전,202305,https://youtube.com/watch?v=MGC_VgnGNUk&pp=ygUQ7J2A7ZaJIOyImOyImOujjA%3D%3D,202305
225,Ripple XRP International Payment Means Declared US Federal Reserve Bank SEC Chairman Should Stop Writing and Resign,12분 전,202305,https://youtube.com/watch?v=yYs46UP5KSg&pp=ygUQ7J2A7ZaJIOyImOyImOujjA%3D%3D,202305
226,Options for a great big sedan Fully Lowest Price Fee X 4 free benefits,4시간 전,202305,https://youtube.com/watch?v=EXRVCwOvTQg&pp=ygUQ7J2A7ZaJIOyImOyImOujjA%3D%3D,202305
227,24 Transfer of ownership due to transfer of real estate ownership registration Transfer of ownership due to donation,1일 전,202305,https://youtube.com/watch?v=P5Q3ncs9me0&pp=ygUQ7J2A7ZaJIOyImOyImOujjA%3D%3D,202305
228,I have to report overseas stock coins by June 30th  If I miss this video  I regret it forever,13시간 전,202305,https://youtube.com/watch?v=01eI7IWKoSo&pp=ygUQ7J2A7ZaJIOyImOyImOujjA%3D%3D,202305
229,Why Bitcoin Is Going Up The Bank Crisis Is Not Over Yet I Am Digital Gold Bitcoin,2.1천,202305,https://youtube.com/watch?v=Qrjzj7RdrC8&pp=ygUQ7J2A7ZaJIOyImOyImOujjA%3D%3D,202305
230,If you are 59 years old or older and receive 4 national pension benefits  try this  You can get extra benefits  Please let your parents know,2.1만,202305,https://youtube.com/watch?v=bmwhsOY3akc&pp=ygUQ7J2A7ZaJIOyImOyImOujjA%3D%3D,202305
231,Bibit futures trading subscription and coin deposit method,7일 전,202305,https://youtube.com/watch?v=IsOh8XoMzPI&pp=ygUQ7J2A7ZaJIOyImOyImOujjA%3D%3D,202305
232,Baek Soo earned 10 billion won for 500 000 won,3주 전,202305,https://youtube.com/watch?v=2wZcLvt1eHk&pp=ygUQ7J2A7ZaJIOyImOyImOujjA%3D%3D,202305
233,These days  100 million units of officetel l 21 pyeong  double floor l Ilsan officetel charter,12일 전,202305,https://youtube.com/watch?v=eHqTlLhMgjQ&pp=ygUQ7J2A7ZaJIOyImOyImOujjA%3D%3D,202305
234,Advertisement Unconditional Overseas Travel Package Carrier Honeytem ft Long distance Travel Honeytip,4주 전,202305,https://youtube.com/watch?v=cdWb1-yDwx4&pp=ygUQ7J2A7ZaJIOyImOyImOujjA%3D%3D,202305
235,003470 Yuanta Securities Stock Price Forecast and Chart Analysis,1개월 전,202305,https://youtube.com/watch?v=FJLCUyEYnG0&pp=ygUQ7J2A7ZaJIOyImOyImOujjA%3D%3D,202305
236,How to treat a woman by Han Nam chung No 1 YouTuber,3주 전,202305,https://youtube.com/watch?v=ugLU2QMYvKQ&pp=ygUQ7J2A7ZaJIOyImOyImOujjA%3D%3D,202305
237,High Dividend Rate of US Treasury Bonds TLTW Covered Call Advantages and Disadvantages,2일 전,202305,https://youtube.com/watch?v=FKIEm7QvazU&pp=ygUQ7J2A7ZaJIOyImOyImOujjA%3D%3D,202305
238,It was also introduced that a person suffering from chronic diseases such as diabetes  hypertension  hyperlipidemia  etc   completed a marathon in 10 years by barefoot walking in the secret of life history broadcasted on KBS by barefoot walking,4일 전,202305,https://youtube.com/watch?v=6Lv6GEDGKQU&pp=ygUQ7J2A7ZaJIOyImOyImOujjA%3D%3D,202305
239,The clan is full of shit  but I can t say anything about my daughter,3주 전,202305,https://youtube.com/watch?v=m3hxB5dFlKE&pp=ygUQ7J2A7ZaJIOyImOyImOujjA%3D%3D,202305
240,Billions of Money Laundering Possibly Cashed In,2주 전,202305,https://youtube.com/watch?v=ybeXiBhHNpo&pp=ygUQ7J2A7ZaJIOyImOyImOujjA%3D%3D,202305
241,PD Notebook 10 Minute Cut Daejangdong Record Lobby Minmul MBC May 2  2023 broadcast,스트리밍 시간: 5일 전,202305,https://youtube.com/watch?v=bR8KH4AqbqY&pp=ygUQ7J2A7ZaJIOyImOyImOujjA%3D%3D,202305
242,May 22 Eagles Morning Live Han Sang hee Analyst,6일 전,202305,https://youtube.com/watch?v=YDVAthF65XU&pp=ygUQ7J2A7ZaJIOyImOyImOujjA%3D%3D,202305
243,Kim Nam kook received 250 million won in government support during the presidential election  not 4 4 million won in cash,4주 전,202305,https://youtube.com/watch?v=cKkLGcAilmw&pp=ygUQ7J2A7ZaJIOyImOyImOujjA%3D%3D,202305
244,How much did you spend on overseas weddings,4일 전,202305,https://youtube.com/watch?v=gGGjRPr2ZXY&pp=ygUQ7J2A7ZaJIOyImOyImOujjA%3D%3D,202305
245,I only knew about Lee Do hoon s interest rate,1일 전,202305,https://youtube.com/watch?v=iQAguusl73Q&pp=ygUQ7J2A7ZaJIOyImOyImOujjA%3D%3D,202305
246,Kim Nam guk s Coin Suspicion Investigation Speed News A Live,3일 전,202305,https://youtube.com/watch?v=iir5l0zUb-o&pp=ygUQ7J2A7ZaJIOyImOyImOujjA%3D%3D,202305
247,We will inform you how to use government 24 which can issue government office complaint documents at home by computer and smart phone,4일 전,202305,https://youtube.com/watch?v=jSp3alY0uLY&pp=ygUQ7J2A7ZaJIOyImOyImOujjA%3D%3D,202305
248,If you follow the real estate crasher  why is your life plunging,3주 전,202305,https://youtube.com/watch?v=kXP7gNe6T_o&pp=ygUQ7J2A7ZaJIOyImOyImOujjA%3D%3D,202305
249,Ripple XRP  10 000 Is It Really Possible  by Krypto Blabla,3주 전,202305,https://youtube.com/watch?v=AqOnqzT2ad0&pp=ygUQ7J2A7ZaJIOyImOyImOujjA%3D%3D,202305
250,Gold investment method that buys gold cheapest and sells expensive gold investment method intensive analysis of gold investment method which enjoys tax exemption benefit of gold investment profit and avoids calculation of monetary income,10일 전,202305,https://youtube.com/watch?v=kbNPCcJFpys&pp=ygUQ7J2A7ZaJIOyImOyImOujjA%3D%3D,202305
251,Ripple Hong Kong deal to start on June 1 with full permissible Ripple 2 dollar base,1만,202305,https://youtube.com/watch?v=4EK2OqJAt5M&pp=ygUQ7J2A7ZaJIOyImOyImOujjA%3D%3D,202305
252,039490 Kiwoom Securities Stock Price Outlook and Chart Analysis,2주 전,202305,https://youtube.com/watch?v=Cahm3Uvsp4w&pp=ygUQ7J2A7ZaJIOyImOyImOujjA%3D%3D,202305
253,Good Morning Economy Concerns about reverse chartering due to pouring occupancy volume Maximum household loan decline YTN,3일 전,202305,https://youtube.com/watch?v=0sicGD6nyWY&pp=ygUQ7J2A7ZaJIOyImOyImOujjA%3D%3D,202305
254,no1102 Dongpadong new construction villa 411 thousand pyeong 41 pyeong high end full option 4 room 2nd floor cancellation Video generation Paju new construction villa,4일 전,202305,https://youtube.com/watch?v=KfldZpN7Y5E&pp=ygUQ7J2A7ZaJIOyImOyImOujjA%3D%3D,202305
255,Bucheon New Apartment Station Area Apartment Unsold Discounts Full of Free Options,7일 전,202305,https://youtube.com/watch?v=o_PwkYi9dDY&pp=ygUQ7J2A7ZaJIOyImOyImOujjA%3D%3D,202305
256,HP LaserJet Pro 3103fdw Performance Analysis High Speed Output Double sided Print Scan Fax with Wireless Printing at a distance of 70Km,7일 전,202305,https://youtube.com/watch?v=uA-dHQqoZQA&pp=ygUQ7J2A7ZaJIOyImOyImOujjA%3D%3D,202305
257,NO137 Bucheon new construction 43 pyeong large pyeong 4 rooms 400 million ultra early,13일 전,202305,https://youtube.com/watch?v=yrL2vw8672c&pp=ygUQ7J2A7ZaJIOyImOyImOujjA%3D%3D,202305
258,230427 Bitcoin market is also beat chews cam lol Let s take a few days off and watch,1개월 전,202305,https://youtube.com/watch?v=XpMsijqaJrY&pp=ygUQ7J2A7ZaJIOyImOyImOujjA%3D%3D,202305
